{
  "schema_version": "ai-dev/role-execution-profile-v1",
  "role_profile_id": "role-profile:builder/v4.9-default",
  "role": "builder",
  "profile_version": "1",
  "source_authority_refs": [
    "fixture:source-authority/task_requirements_authority_agreeing.json#current",
    "ads:std/EXECUTION_ARCHITECTURE_STANDARD.md#11"
  ],
  "source_authority_projection": {
    "projection_state": "PROJECTED",
    "resolution_policy": "source-authorities-prevail-never-last-writer-wins"
  },
  "required_input_refs": [
    "ads:schema/execution-pack-manifest.schema.json#pack_id"
  ],
  "allowed_actions": [
    "implement declared write-set paths inside the owned concern",
    "run required deterministic checks",
    "report deviations, blockers and new authority gaps"
  ],
  "forbidden_actions": [
    "self-approve an independent gate",
    "merge the candidate",
    "mutate read-only owner surfaces",
    "begin authoritative mutation before an accepted Claim"
  ],
  "required_evidence_refs": [
    "ads:schema/agent-capability-evidence-v1.schema.json#exact_subject_ref"
  ],
  "terminal_authority_ref": "ads:std/EXECUTION_ARCHITECTURE_STANDARD.md#11",
  "eligibility_predicate_refs": [
    "ads:std/EXECUTION_ARCHITECTURE_STANDARD.md#27.2"
  ],
  "independence_requirement_refs": [
    "ads:std/ASSURANCE_PLAN_STANDARD.md#10"
  ],
  "environment_requirement_refs": [
    "ads:schema/dependency-toolchain-profile-v1.schema.json#toolchains"
  ],
  "mutation_class": "MUTABLE",
  "claim_policy_ref": "ads:std/EXECUTION_ARCHITECTURE_STANDARD.md#11",
  "handoff_requirement_refs": [
    "ads:std/EXECUTION_ARCHITECTURE_STANDARD.md#12"
  ]
}
