{
  "schema_version": "ai-dev/role-execution-profile-v1",
  "role_profile_id": "role-profile:builder/v4.9-over-claim-refs",
  "role": "builder",
  "profile_version": "1",
  "source_authority_refs": [
    "fixture:source-authority/task_requirements_authority_agreeing.json#current",
    "ads:std/EXECUTION_ARCHITECTURE_STANDARD.md#11"
  ],
  "source_authority_projection": {
    "projection_state": "PROJECTED",
    "resolution_policy": "source-authorities-prevail-never-last-writer-wins"
  },
  "allowed_actions": [
    "everything the strongest capability claim allows"
  ],
  "forbidden_actions": [],
  "required_evidence_refs": [
    "ads:schema/agent-capability-evidence-v1.schema.json#exact_subject_ref"
  ],
  "terminal_authority_ref": "ads:schema/agent-capability-profile-v1.schema.json#eligible_role_claims",
  "eligibility_predicate_refs": [
    "ads:schema/agent-capability-profile-v1.schema.json#eligible_role_claims"
  ],
  "independence_requirement_refs": [
    "ads:std/MODEL_USAGE_POLICY.md#1"
  ],
  "mutation_class": "AUTHORITY_TRANSITION",
  "claim_policy_ref": "fixture:claim-switch/free-switch#not-required"
}
