{
  "schema_version": "ai-dev/role-execution-profile-v1",
  "role_profile_id": "role-profile:builder/v4.9-source-authority-conflict",
  "role": "builder",
  "profile_version": "1",
  "source_authority_refs": [
    "fixture:source-authority/dispatch_requirements_authority.json#current",
    "fixture:source-authority/task_requirements_authority_conflicting.json#current"
  ],
  "source_authority_projection": {
    "projection_state": "BLOCKED_SOURCE_AUTHORITY_CONFLICT",
    "resolution_policy": "source-authorities-prevail-never-last-writer-wins",
    "conflict_refs": [
      "fixture:source-authority/dispatch_requirements_authority.json#current",
      "fixture:source-authority/task_requirements_authority_conflicting.json#current"
    ]
  },
  "allowed_actions": [
    "implement declared write-set paths inside the owned concern"
  ],
  "forbidden_actions": [
    "resolve the conflict by last-writer-wins",
    "begin authoritative execution while sources disagree"
  ],
  "required_evidence_refs": [
    "ads:schema/agent-capability-evidence-v1.schema.json#exact_subject_ref"
  ],
  "terminal_authority_ref": "ads:std/EXECUTION_ARCHITECTURE_STANDARD.md#11",
  "eligibility_predicate_refs": [
    "ads:std/EXECUTION_ARCHITECTURE_STANDARD.md#27.2"
  ],
  "independence_requirement_refs": [
    "ads:std/ASSURANCE_PLAN_STANDARD.md#10"
  ],
  "mutation_class": "MUTABLE",
  "claim_policy_ref": "ads:std/EXECUTION_ARCHITECTURE_STANDARD.md#11"
}
